{
  "source_id": "src_20260713_001_example",
  "source_path": "source_data/src_20260713_001_example/original/example.pdf",
  "raw_text_path": "extracted_data/src_20260713_001_example/raw_text.txt",
  "extracted_text_path": "extracted_data/src_20260713_001_example/extracted_text.json",
  "media_type": "application/pdf",
  "extractor": "pdf_to_text",
  "extraction_method": "native_text_layer",
  "status": "ok",
  "warnings": [],
  "layout_warnings": [],
  "ocr_used": false,
  "language_hint": "eng"
}
